CurrentSEED,NewSEED,PM1,PM2,Type,,Current Status Timestamp,Energy Current Date,energyCurrentDate,date,ENERGY STAR Certification - Application Status,ENERGY STAR Certification Assessment Application Status,ENERGY STAR Certification - Application Status,energyStarCertificationApplicationStatus,string,ENERGY STAR Certification - Eligibility,ENERGY STAR Certification Assessment Eligibility,ENERGY STAR Certification - Eligibility,energyStarCertificationEligibility,string,ENERGY STAR Certification - Last Approval Date,ENERGY STAR Certification Assessment Last Approval Date,ENERGY STAR Certification - Last Approval Date,energyStarCertificationLastApprovalDate,date,ENERGY STAR Certification - Next Eligible Date,ENERGY STAR Certification Assessment Next Eligible Date,ENERGY STAR Certification - Next Eligible Date,energyStarCertificationNextEligibleDate,date,ENERGY STAR Certification - Profile Published,ENERGY STAR Certification Assessment Profile,ENERGY STAR Certification - Profile Published,energyStarCertificationProfilePublished,string,ENERGY STAR Certification - Year(s) Certified,ENERGY STAR Certification Assessment Year,ENERGY STAR Certification - Year(s) Certified,energyStarCertificationYears,date,ENERGY Star Score,ENERGY STAR Score Assessment Metric Value,ENERGY STAR Score,score,float,"Energy/Power Station - Computer Density (Number per 1,000 ft2)",,"Energy/Power Station - Computer Density (Number per 1,000 ft2)",energyPowerStationComputerDensity,float,Energy/Power Station - Gross Floor Area (ft2),Component Energy Generation Plant Gross Floor Area,Energy/Power Station - Gross Floor Area (ft2),energyPowerStationGrossFloorArea,float,Energy/Power Station - Number of Computers,Component Energy Generation Plant Computer Quantity,Energy/Power Station - Number of Computers,energyPowerStationNumberOfComputers,float,Energy/Power Station - Number of Workers on Main Shift,Component Energy Generation Plant Workers on Main Shift Occupant Quantity,Energy/Power Station - Number of Workers on Main Shift,energyPowerStationNumberOfWorkersOnMainShift,float,Energy/Power Station - Weekly Operating Hours,Component Energy Generation Plant Business Average Weekly Hours,Energy/Power Station - Weekly Operating Hours,energyPowerStationWeeklyOperatingHours,float,"Energy/Power Station - Worker Density (Number per 1,000 ft2)",,"Energy/Power Station - Worker Density (Number per 1,000 ft2)",energyPowerStationWorkerDensity,float,,Alternative Water Generated On-Site Indoor Derivation Method,Estimated Data Flag -  Alternative Water Generated On-Site � Indoor Use,estimatedDataFlagAlternativeWaterGeneratedOnSiteIndoorUse,float,,Alternative Water Generated On-Site Outdoor Derivation Method,Estimated Data Flag -  Alternative Water Generated On-Site � Outdoor Use,estimatedDataFlagAlternativeWaterGeneratedOnSiteOutdoorUse,float,,IT Derivation Method,Estimated Data Flag -  Data Center IT Equipment Input Site Energy,estimatedDataFlagDataCenterItEquipmentInputSiteEnergy,float,,Power Distribution Unit (PDU) Input Energy Derivation Method,Estimated Data Flag -  Data Center PDU Input Site Energy,estimatedDataFlagDataCenterPduInputSiteEnergy,float,,Power Distribution Unit (PDU) Output Energy Derivation Method,Estimated Data Flag -  Data Center PDU Output Site Energy,estimatedDataFlagDataCenterPduOutputSiteEnergy,float,,UPS Output Site Energy Derivation Method,Estimated Data Flag -  Data Center UPS Output Site Energy,estimatedDataFlagDataCenterUpsOutputSiteEnergy,float,,Municipally Supplied Potable Water Indoor Derivation Method,Estimated Data Flag -  Municipally Supplied Potable Water � Indoor Use,estimatedDataFlagMunicipallySuppliedPotableWaterIndoorUse,float,,Municipally Supplied Potable Water Outdoor Derivation Method,Estimated Data Flag -  Municipally Supplied Potable Water � Outdoor Use,estimatedDataFlagMunicipallySuppliedPotableWaterOutdoorUse,float,,Municipally Supplied Reclaimed Water Indoor Derivation Method,Estimated Data Flag -  Municipally Supplied Reclaimed Water � Indoor Use,estimatedDataFlagMunicipallySuppliedReclaimedWaterIndoorUse,float,,Municipally Supplied Reclaimed Water Outdoor Derivation Method,Estimated Data Flag -  Municipally Supplied Reclaimed Water � Outdoor Use,estimatedDataFlagMunicipallySuppliedReclaimedWaterOutdoorUse,float,,Water Indoor Derivation Method,Estimated Data Flag -  Other Water Sources � Indoor Use,estimatedDataFlagOtherWaterSourcesIndoorUse,string,,Water Outdoor Derivation Method,Estimated Data Flag -  Other Water Sources � Outdoor Use,estimatedDataFlagOtherWaterSourcesOutdoorUse,string,,Alternative Water Generated On-Site Indoor Outdoor Other Derivation Method,Estimated Data Flag - Alternative Water Generated On-Site: Combined Indoor/Outdoor or Other Use,estimatedDataFlagAlternativeWaterGeneratedOnSiteAllUse,string,,Coal (anthracite) Derivation Method,Estimated Data Flag - Coal (anthracite),estimatedDataFlagCoalAnthracite,string,,Coal (bituminous) Derivation Method,Estimated Data Flag - Coal (bituminous),estimatedDataFlagCoalBituminous,string,,Coke Derivation Method,Estimated Data Flag - Coke,estimatedDataFlagCoke,string,,Diesel Derivation Method,Estimated Data Flag - Diesel,estimatedDataFlagDiesel,string,,District Chilled Water Derivation Method,Estimated Data Flag - District Chilled Water,estimatedDataFlagDistrictChilledWater,string,,District Hot Water Derivation Method,Estimated Data Flag - District Hot Water,estimatedDataFlagDistrictHotWater,string,,District Steam Derivation Method,Estimated Data Flag - District Steam,estimatedDataFlagDistrictSteam,string,,Electricity Utility provided Derivation Method,Estimated Data Flag - Electricity (Grid Purchase),estimatedDataFlagElectricityGridPurchase,string,,Electricity Photovoltaic Onsite renewable Derivation Method,Estimated Data Flag - Electricity (On-Site Solar),estimatedDataFlagElectricityOnsiteSolar,string,,Fuel Oil No-1 Derivation Method,Estimated Data Flag - Fuel Oil (No. 1),estimatedDataFlagFuelOilNo1,string,,Fuel Oil No-2 Derivation Method,Estimated Data Flag - Fuel Oil (No. 2),estimatedDataFlagFuelOilNo2,string,,Fuel Oil No-4 Derivation Method,Estimated Data Flag - Fuel Oil (No. 4),estimatedDataFlagFuelOilNo4,string,,Fuel Oil No-5 and No-6 Derivation Method,Estimated Data Flag - Fuel Oil (No. 5 and No. 6),estimatedDataFlagFuelOilNo5AndNo6,string,,Kerosene Derivation Method,Estimated Data Flag - Kerosene,estimatedDataFlagKerosene,string,,Liquid Propane Derivation Method,Estimated Data Flag - Liquid Propane,estimatedDataFlagLiquidPropane,string,,Municipally Supplied Potable Water Indoor Outdoor Other Derivation Method,Estimated Data Flag - Municipally Supplied Potable Water: Combined Indoor/Outdoor or Other Use,estimatedDataFlagMunicipallySuppliedPotableWaterAllUse,string,,Municipally Supplied Reclaimed Water Indoor Outdoor Other Derivation Method,Estimated Data Flag - Municipally Supplied Reclaimed Water: Combined Indoor/Outdoor or Other Use,estimatedDataFlagMunicipallySuppliedReclaimedWaterAllUse,string,,Natural Gas Derivation Method,Estimated Data Flag - Natural Gas,estimatedDataFlagNaturalGas,string,,Other Derivation Method,Estimated Data Flag - Other,estimatedDataFlagOther,string,,Water Indoor Outdoor Other Derivation Method,Estimated Data Flag - Other Water Sources: Combined Indoor/Outdoor or Other Use,estimatedDataFlagOtherWaterSourcesAllUse,string,,Flow Derivation Method,Estimated Data Flag - Plant Flow Meter,estimatedDataFlagPlantFlowMeter,string,,Propane Derivation Method,Estimated Data Flag - Propane,estimatedDataFlagPropane,string,,Wood Derivation Method,Estimated Data Flag - Wood,estimatedDataFlagWood,string,"Estimated Savings from Energy Projects, Cumulative ($)",Total Resource and Non-resource Estimated Non-resource Cost Benefits,"Estimated Savings from Energy Projects, Cumulative ($)",estimatedSavingsFromUpgradesCumulativeDollars,float,"Estimated Savings from Energy Projects, Cumulative ($/ft2)",Total Resource and Non-resource Estimated Non-resource Cost Benefit Intensity,"Estimated Savings from Energy Projects, Cumulative ($/ft2)",estimatedSavingsFromUpgradesCumulativeDollarsPerSqft,float,"Fast Food Restaurant - Computer Density (Number per 1,000 ft2)",,"Fast Food Restaurant - Computer Density (Number per 1,000 ft2)",fastFoodRestaurantComputerDensity,float,Fast Food Restaurant - Gross Floor Area (ft2),Component Fast Food Service Gross Floor Area,Fast Food Restaurant - Gross Floor Area (ft2),fastFoodRestaurantGrossFloorArea,float,Fast Food Restaurant - Number of Computers,Component Fast Food Service Computer Quantity,Fast Food Restaurant - Number of Computers,fastFoodRestaurantNumberOfComputers,float,Fast Food Restaurant - Number of Workers on Main Shift,Component Fast Food Service Workers on Main Shift Occupant Quantity,Fast Food Restaurant - Number of Workers on Main Shift,fastFoodRestaurantNumberOfWorkersOnMainShift,float,Fast Food Restaurant - Weekly Operating Hours,Component Fast Food Service Business Average Weekly Hours,Fast Food Restaurant - Weekly Operating Hours,fastFoodRestaurantWeeklyOperatingHours,float,"Fast Food Restaurant - Worker Density (Number per 1,000 ft2)",,"Fast Food Restaurant - Worker Density (Number per 1,000 ft2)",fastFoodRestaurantWorkerDensity,float,Federal Agency/Department,Federal Government Agency Company,Federal Agency/Department,,string,Federal Region/Sub-Department,Government Agency Company,Federal Region/Sub-Department,,string,"Financial Office - Computer Density (Number per 1,000 ft2)",,"Financial Office - Computer Density (Number per 1,000 ft2)",financialOfficeComputerDenisty,float,Financial Office - Gross Floor Area (ft2),Component Office Gross Floor Area,Financial Office - Gross Floor Area (ft2),financialOfficeGrossFloorArea,float,Financial Office - Number of Computers,Component Office Computer Quantity,Financial Office - Number of Computers,financialOfficeNumberOfComputers,float,Financial Office - Number of Workers on Main Shift,Component Office Workers on Main Shift Occupant Quantity,Financial Office - Number of Workers on Main Shift,financialOfficeNumberOfWorkersOnMainShift,float,Financial Office - Percent That Can Be Cooled,,Financial Office - Percent That Can Be Cooled,financialOfficePercentThatCanBeCooled,string,Financial Office - Percent That Can Be Heated,,Financial Office - Percent That Can Be Heated,financialOfficePercentThatCanBeHeated,string,Financial Office - Weekly Operating Hours,Component Office Business Average Weekly Hours,Financial Office - Weekly Operating Hours,financialOfficeWeeklyOperatingHours,float,"Financial Office - Worker Density (Number per 1,000 ft2)",,"Financial Office - Worker Density (Number per 1,000 ft2)",financialOfficeWorkerDensity,float,"Fire Station - Computer Density (Number per 1,000 ft2)",,"Fire Station - Computer Density (Number per 1,000 ft2)",fireStationComputerDensity,float,Fire Station - Gross Floor Area (ft2),Component Public Safety Station Gross Floor Area,Fire Station - Gross Floor Area (ft2),fireStationGrossFloorArea,float,Fire Station - Number of Computers,Component Public Safety Station Computer Quantity,Fire Station - Number of Computers,fireStationNumberOfComputers,float,Fire Station - Number of Workers on Main Shift,Component Public Safety Station Workers on Main Shift Occupant Quantity,Fire Station - Number of Workers on Main Shift,fireStationNumberOfWorkersOnMainShift,float,Fire Station - Weekly Operating Hours,Component Public Safety Station Business Average Weekly Hours,Fire Station - Weekly Operating Hours,fireStationWeeklyOperatingHours,float,"Fire Station - Worker Density (Number per 1,000 ft2)",,"Fire Station - Worker Density (Number per 1,000 ft2)",fireStationWorkerDensity,float,"Fitness Center/Health Club/Gym - Computer Density (Number per 1,000 ft2)",,"Fitness Center/Health Club/Gym - Computer Density (Number per 1,000 ft2)",fitnessCenterHealthClubGymComputerDensity,float,Fitness Center/Health Club/Gym - Gross Floor Area (ft2),,Fitness Center/Health Club/Gym - Gross Floor Area (ft2),fitnessCenterHealthClubGymGrossFloorArea,float,Fitness Center/Health Club/Gym - Number of Computers,Component Fitness Center Computer Quantity,Fitness Center/Health Club/Gym - Number of Computers,fitnessCenterHealthClubGymNumberOfComputers,float,Fitness Center/Health Club/Gym - Number of Workers on Main Shift,Component Fitness Center Workers on Main Shift Occupant Quantity,Fitness Center/Health Club/Gym - Number of Workers on Main Shift,fitnessCenterHealthClubGymNumberOfWorkersOnMainShift,float,Fitness Center/Health Club/Gym - Weekly Operating Hours,Component Fitness Center Business Average Weekly Hours,Fitness Center/Health Club/Gym - Weekly Operating Hours,fitnessCenterHealthClubGymWeeklyOperatingHours,float,"Fitness Center/Health Club/Gym - Worker Density (Number per 1,000 ft2)",,"Fitness Center/Health Club/Gym - Worker Density (Number per 1,000 ft2)",fitnessCenterHealthClubGymWorkerDensity,float,"Food Sales - Computer Density (Number per 1,000 ft2)",,"Food Sales - Computer Density (Number per 1,000 ft2)",foodSalesComputerDensity,float,Food Sales - Gross Floor Area (ft2),Component Food Sales Gross Floor Area,Food Sales - Gross Floor Area (ft2),foodSalesGrossFloorArea,float,Food Sales - Number of Computers,Component Food Sales Computer Quantity,Food Sales - Number of Computers,foodSalesNumberOfComputers,float,Food Sales - Number of Workers on Main Shift,Component Food Sales Workers on Main Shift Occupant Quantity,Food Sales - Number of Workers on Main Shift,foodSalesNumberOfWorkersOnMainShift,float,Food Sales - Weekly Operating Hours,Component Food Sales Business Average Weekly Hours,Food Sales - Weekly Operating Hours,foodSalesWeeklyOperatingHours,float,"Food Sales - Worker Density (Number per 1,000 ft2)",,"Food Sales - Worker Density (Number per 1,000 ft2)",foodSalesWorkerDensity,float,"Food Service - Computer Density (Number per 1,000 ft2)",,"Food Service - Computer Density (Number per 1,000 ft2)",foodServiceComputerDensity,float,Food Service - Gross Floor Area (ft2),Component Food Service Gross Floor Area,Food Service - Gross Floor Area (ft2),foodServiceGrossFloorArea,float,Food Service - Number of Computers,Component Food Service Computer Quantity,Food Service - Number of Computers,foodServiceNumberOfComputers,float,Food Service - Number of Workers on Main Shift,Component Food Service Workers on Main Shift Occupant Quantity,Food Service - Number of Workers on Main Shift,foodServiceNumberOfWorkersOnMainShift,float,Food Service - Weekly Operating Hours,Component Food Service Business Average Weekly Hours,Food Service - Weekly Operating Hours,foodServiceWeeklyOperatingHours,float,"Food Service - Worker Density (Number per 1,000 ft2)",,"Food Service - Worker Density (Number per 1,000 ft2)",foodServiceWorkerDensity,float,Fuel Oil (No. 1) Cost ($),Fuel Oil No-1 Resource Cost,Fuel Oil (No. 1) Cost ($),energyCostFuelOil1,float,Fuel Oil (No. 2) Cost ($),Fuel Oil No-2 Resource Cost,Fuel Oil (No. 2) Cost ($),energyCostFuelOil2,float,Fuel Oil (No. 4) Cost ($),Fuel Oil No-4 Resource Cost,Fuel Oil (No. 4) Cost ($),energyCostFuelOil4,float,Fuel Oil (No. 5 and No. 6) Cost ($),Fuel Oil No-5 and No-6 Resource Cost,Fuel Oil (No. 5 and No. 6) Cost ($),energyCostFuelOil5And6,float,Fuel Oil #1 Use (kBtu),Fuel Oil No-1 Resource Use,Fuel Oil #1 Use (kBtu),siteEnergyUseFuelOil1,float,Fuel Oil #2 Use (kBtu),Fuel Oil No-2 Resource Use,Fuel Oil #2 Use (kBtu),siteEnergyUseFuelOil2,float,Fuel Oil #4 Use (kBtu),Fuel Oil No-4 Resource Use,Fuel Oil #4 Use (kBtu),siteEnergyUseFuelOil4,float,Fuel Oil #5 & 6 Use (kBtu),Fuel Oil No-5 and No-6 Resource Use,Fuel Oil #5 & 6 Use (kBtu),siteEnergyUseFuelOil5And6,float,,Premises Green Globes CIEB Project ID Identifier Value,Green Globes CIEB Project ID,,string,,Premises Green Globes NC Project ID Identifier Value,Green Globes NC Project ID,,string,Green Power - Offsite (kWh),Offsite Green Power,Green Power - Offsite (kWh),greenPowerOffSite,float,Green Power - Onsite (kWh),Onsite Green Power,Green Power - Onsite (kWh),greenPowerOnSite,float,Green Power - Onsite and Offsite (kWh),Onsite and Offsite Green Power,Green Power - Onsite and Offsite (kWh),greenPowerOnSiteAndOffSite,float,Guiding Principle 1.1 Integrated - Team,Guiding Principle 1.1 Integrated - Team,Guiding Principle 1.1 Integrated - Team,federalGuidingPrinciplesIntegratedTeam,string,Guiding Principle 1.2 Integrated - Goals,Guiding Principle 1.2 Integrated - Goals,Guiding Principle 1.2 Integrated - Goals,federalGuidingPrinciplesIntegratedGoals,string,Guiding Principle 1.3 Integrated - Plan,Guiding Principle 1.3 Integrated - Plan,Guiding Principle 1.3 Integrated - Plan,federalGuidingPrinciplesIntegratedPlan,string,Guiding Principle 1.4 Integrated -Occupant Feedback,Guiding Principle 1.4 Integrated -Occupant Feedback,Guiding Principle 1.4 Integrated -Occupant Feedback,federalGuidingPrinciplesIntegratedOccupantFeedback,string,Guiding Principle 1.5 Integrated - Commissioning,Guiding Principle 1.5 Integrated - Commissioning,Guiding Principle 1.5 Integrated - Commissioning,federalGuidingPrinciplesIntegratedCommissioning,string,Guiding Principle 2.1 Energy - Energy Efficiency Any Option (Any Option),Guiding Principle 2.1 Energy - Energy Efficiency Any Option (Any Option),Guiding Principle 2.1  Energy - Energy Efficiency (Any Option),federalGuidingPrinciplesEnergyEfficiencyAnyOption,string,Guiding Principle 2.1 Energy Efficiency - Option 1,Guiding Principle 2.1 Energy Efficiency - Option 1,Guiding Principle 2.1 Energy Efficiency - Option 1,federalGuidingPrinciplesEnergyEfficiencyOption1,string,Guiding Principle 2.1 Energy Efficiency - Option 2,Guiding Principle 2.1 Energy Efficiency - Option 2,Guiding Principle 2.1 Energy Efficiency - Option 2,federalGuidingPrinciplesEnergyEfficiencyOption2,string,Guiding Principle 2.1 Energy Efficiency - Option 3,Guiding Principle 2.1 Energy Efficiency - Option 3,Guiding Principle 2.1 Energy Efficiency - Option 3,federalGuidingPrinciplesEnergyEfficiencyOption3,string,Guiding Principle 2.2 Energy - Efficient Products,Guiding Principle 2.2 Energy - Efficient Products,Guiding Principle 2.2 Energy - Efficient Products,federalGuidingPrinciplesEnergyEfficientProducts,string,Guiding Principle 2.3 Energy - Onsite Renewable,Guiding Principle 2.3 Energy - Onsite Renewable,Guiding Principle 2.3  Energy - Onsite Renewable,federalGuidingPrinciplesEnergyOnsiteRenewable,string,Guiding Principle 2.4 Energy - Measurement and Verification,Guiding Principle 2.4 Energy - Measurement and Verification,Guiding Principle 2.4 Energy - Measurement and Verification,federalGuidingPrinciplesEnergyMeasurementVerification,string,Guiding Principle 2.5 Energy - Benchmarking,Guiding Principle 2.5 Energy - Benchmarking,Guiding Principle 2.5 Energy - Benchmarking,federalGuidingPrinciplesEnergyBenchmarking,string,Guiding Principle 3.1 Indoor Water - Option 1,Guiding Principle 3.1 Indoor Water - Option 1,Guiding Principle 3.1 Indoor Water - Option 1,federalGuidingPrinciplesWaterIndoorWaterOption1,string,Guiding Principle 3.1 Indoor Water - Option 2,Guiding Principle 3.1 Indoor Water - Option 2,Guiding Principle 3.1 Indoor Water - Option 2,federalGuidingPrinciplesWaterIndoorWaterOption2,string,Guiding Principle 3.1 Water - Indoor Water Any Option (Any Option),Guiding Principle 3.1 Water - Indoor Water Any Option (Any Option),Guiding Principle 3.1 Water - Indoor Water (Any Option),federalGuidingPrinciplesWaterIndoorWaterAnyOption,string,Guiding Principle 3.2 Outdoor Water - Option 1,Guiding Principle 3.2 Outdoor Water - Option 1,Guiding Principle 3.2 Outdoor Water - Option 1,federalGuidingPrinciplesWaterOutdoorWaterOption1,string,Guiding Principle 3.2 Outdoor Water - Option 2,Guiding Principle 3.2 Outdoor Water - Option 2,Guiding Principle 3.2 Outdoor Water - Option 2,federalGuidingPrinciplesWaterOutdoorWaterOption2,string,Guiding Principle 3.2 Outdoor Water - Option 3,Guiding Principle 3.2 Outdoor Water - Option 3,Guiding Principle 3.2 Outdoor Water - Option 3,federalGuidingPrinciplesWaterOutdoorWaterOption3,string,Guiding Principle 3.2 Water - Outdoor Water Any Option (Any Option),Guiding Principle 3.2 Water - Outdoor Water Any Option (Any Option),Guiding Principle 3.2 Water - Outdoor Water (Any Option),federalGuidingPrinciplesWaterOutdoorWaterAnyOption,string,Guiding Principle 3.3 Water - Stormwater,Guiding Principle 3.3 Water - Stormwater,Guiding Principle 3.3 Water - Stormwater,federalGuidingPrinciplesWaterStormWater,string,Guiding Principle 3.4 Water - Efficient Products,Guiding Principle 3.4 Water - Efficient Products,Guiding Principle 3.4 Water - Efficient Products,federalGuidingPrinciplesWaterEfficientProducts,string,Guiding Principle 4.1 Indoor Environment - Ventilation and Thermal Comfort,Guiding Principle 4.1 Indoor Environment - Ventilation and Thermal Comfort,Guiding Principle 4.1 Indoor Environment - Ventilation and Thermal Comfort,federalGuidingPrinciplesIndoorEnvironmentVentilationThermalComfort,string,Guiding Principle 4.2 Indoor Environment - Moisture Control,Guiding Principle 4.2 Indoor Environment - Moisture Control,Guiding Principle 4.2 Indoor Environment - Moisture Control,federalGuidingPrinciplesIndoorEnvironmentMoistureControl,string,Guiding Principle 4.3 Indoor Environment - Automated Lighting Controls,Guiding Principle 4.3 Indoor Environment - Automated Lighting Controls,Guiding Principle 4.3 Indoor Environment - Automated Lighting Controls,federalGuidingPrinciplesIndoorEnvironmentAutomatedLightingControls,string,Guiding Principle 4.4 Daylighting and Occupant Controls - Option 1,Guiding Principle 4.4 Daylighting and Occupant Controls - Option 1,Guiding Principle 4.4 Daylighting and Occupant Controls - Option 1,federalGuidingPrinciplesIndoorEnvironmentDaylightingOccupantControlsOption1,string,Guiding Principle 4.4 Daylighting and Occupant Controls - Option 2,Guiding Principle 4.4 Daylighting and Occupant Controls - Option 2,Guiding Principle 4.4 Daylighting and Occupant Controls - Option 2,federalGuidingPrinciplesIndoorEnvironmentDaylightingOccupantControlsOption2,string,Guiding Principle 4.4 Indoor Environment - Daylighting and Occupant Controls Any Option (Any Option),Guiding Principle 4.4 Indoor Environment - Daylighting and Occupant Controls Any Option (Any Option),Guiding Principle 4.4 Indoor Environment - Daylighting and Occupant Controls (Any Option),federalGuidingPrinciplesIndoorEnvironmentDaylightingOccupantControlsAnyOption,string,Guiding Principle 4.5 Indoor Environment - Low-Emitting Materials,Guiding Principle 4.5 Indoor Environment - Low-Emitting Materials,Guiding Principle 4.5 Indoor Environment - Low-Emitting Materials,federalGuidingPrinciplesIndoorEnvironmentLowEmittingMaterials,string,Guiding Principle 4.6 Indoor Environment - Integrated Pest Management,Guiding Principle 4.6 Indoor Environment - Integrated Pest Management,Guiding Principle 4.6 Indoor Environment - Integrated Pest Management,federalGuidingPrinciplesIndoorEnvironmentIntegratedPestManagement,string,Guiding Principle 4.7 Indoor Environment - Tobacco Smoke Control,Guiding Principle 4.7 Indoor Environment - Tobacco Smoke Control,Guiding Principle 4.7 Indoor Environment - Tobacco Smoke Control,federalGuidingPrinciplesIndoorEnvironmentTobaccoSmokeControl,string,Guiding Principle 5.1 Materials - Recycled Content,Guiding Principle 5.1 Materials - Recycled Content,Guiding Principle 5.1 Materials - Recycled Content,federalGuidingPrinciplesMaterialsRecycledContent,string,Guiding Principle 5.2 Materials - Biobased Content,Guiding Principle 5.2 Materials - Biobased Content,Guiding Principle 5.2 Materials - Biobased Content,federalGuidingPrinciplesMaterialsBiobasedContent,string,Guiding Principle 5.3 Materials - Environmentally Preferred Products,Guiding Principle 5.3 Materials - Environmentally Preferred Products,Guiding Principle 5.3 Materials - Environmentally Preferred Products,federalGuidingPrinciplesMaterialsEnvironmentallyPreferableProducts,string,Guiding Principle 5.4 Materials - Waste and Materials Mgmt,Guiding Principle 5.4 Materials - Waste and Materials Mgmt,Guiding Principle 5.4 Materials - Waste and Materials Mgmt,federalGuidingPrinciplesMaterialsWasteMaterialsMgmt,string,Guiding Principle 5.5 Materials - Ozone Depleting Compounds,Guiding Principle 5.5 Materials - Ozone Depleting Compounds,Guiding Principle 5.5 Materials - Ozone Depleting Compounds,federalGuidingPrinciplesMaterialsOzoneDepletingCompounds,string,Guiding Principles - % In Process,Guiding Principles - % In Process,Guiding Principles -  % In Process,federalGuidingPrinciplesPercentInProcess,string,Guiding Principles - % No,Guiding Principles - % No,Guiding Principles -  % No,federalGuidingPrinciplesPercentNo,string,Guiding Principles - % Not Applicable,Guiding Principles - % Not Applicable,Guiding Principles -  % Not Applicable,federalGuidingPrinciplesPercentNotApplicable,string,Guiding Principles - % Not Assessed,Guiding Principles - % Not Assessed,Guiding Principles -  % Not Assessed,federalGuidingPrinciplesPercentNotAssessed,string,Guiding Principles - % Yes,Guiding Principles - % Yes,Guiding Principles -  % Yes,federalGuidingPrinciplesPercentYes,string,Guiding Principles - % Complete (Yes or Not Applicable),Guiding Principles - % Complete (Yes or Not Applicable),Guiding Principles - % Complete (Yes or Not Applicable),federalGuidingPrinciplesPercentComplete,string,Guiding Principles - Checklist Manager,Guiding Principles - Checklist Manager,Guiding Principles - Checklist Manager,federalGuidingPrinciplesChecklistManager,string,Guiding Principles - Principles Date Achieved,Guiding Principles - Principles Date Achieved,Guiding Principles - Principles Date Achieved,federalGuidingPrinciplesDateAchieved,string,